{
  "schema_version": 1,
  "resource_kind": "workflow",
  "resource_id": "ca4r54b.workflow.civil-rule54b",
  "initial_stage_id": "ca4r54b.stage.notice-window",
  "stages": [
    "ca4r54b.stage.notice-window",
    "ca4r54b.stage.docketed",
    "ca4r54b.stage.initial-requirements",
    "ca4r54b.stage.briefing",
    "ca4r54b.stage.response-briefing",
    "ca4r54b.stage.submitted",
    "ca4r54b.stage.judgment",
    "ca4r54b.stage.rehearing",
    "ca4r54b.stage.mandate-issued"
  ],
  "operations": [
    {
      "operation_id": "ca4r54b.operation.calculate-notice-deadline",
      "stage_id": "ca4r54b.stage.notice-window",
      "opcode": "calculate_deadline",
      "authority": {
        "primary": {
          "authority_id": "ca4r54b.authority.usc-2107a",
          "citation": "28 U.S.C. § 2107(a) (2023 ed.)",
          "source_version": "2024-01-03",
          "proposition": "Unless another part of section 2107 applies, a civil notice of appeal must be filed within 30 days after entry of the judgment, order, or decree.",
          "source_url": "https://www.govinfo.gov/content/pkg/USCODE-2023-title28/pdf/USCODE-2023-title28-partV-chap133-sec2107.pdf"
        },
        "supporting": [
          {
            "authority_id": "ca4r54b.authority.frap-4a1",
            "citation": "Fed. R. App. P. 4(a)(1)(A) (Fourth Circuit rulebook Mar. 23, 2026)",
            "source_version": "2026-03-23",
            "proposition": "In an ordinary private-party civil case, the notice of appeal must be filed with the district clerk within 30 days after entry of the judgment or order appealed from.",
            "source_url": "https://www.ca4.uscourts.gov/Rules/Rule04.html"
          },
          {
            "authority_id": "ca4r54b.authority.frap-26a",
            "citation": "Fed. R. App. P. 26(a), (c) (Fourth Circuit rulebook Mar. 23, 2026)",
            "source_version": "2026-03-23",
            "proposition": "For a period stated in days, exclude the trigger day, count intermediate weekends and legal holidays, and extend a weekend or legal-holiday last day; three additional service days do not apply to electronic service.",
            "source_url": "https://www.ca4.uscourts.gov/rules/Rule26.html"
          }
        ]
      },
      "deadline_days": 30,
      "deadline_counting": "calendar_days",
      "authorized_role_ids": ["ca4r54b.role.court"]
    },
    {
      "operation_id": "ca4r54b.operation.accept-notice",
      "stage_id": "ca4r54b.stage.notice-window",
      "opcode": "accept_filing",
      "authority": {
        "primary": {
          "authority_id": "ca4r54b.authority.frap-3",
          "citation": "Fed. R. App. P. 3(a), (c) (Fourth Circuit rulebook Mar. 23, 2026)",
          "source_version": "2026-03-23",
          "proposition": "An appeal as of right is taken by timely filing a notice with the district clerk; the notice identifies the appellant, the appealed judgment or order, and the court of appeals.",
          "source_url": "https://www.ca4.uscourts.gov/rules/Rule03.html"
        },
        "supporting": []
      },
      "authorized_role_ids": ["ca4r54b.role.appellant"]
    },
    {
      "operation_id": "ca4r54b.operation.reject-notice",
      "stage_id": "ca4r54b.stage.notice-window",
      "opcode": "reject_filing",
      "authority": {
        "primary": {
          "authority_id": "ca4r54b.authority.frap-3",
          "citation": "Fed. R. App. P. 3(a), (c) (Fourth Circuit rulebook Mar. 23, 2026)",
          "source_version": "2026-03-23",
          "proposition": "An appeal as of right is taken by timely filing a notice with the district clerk; the notice identifies the appellant, the appealed judgment or order, and the court of appeals.",
          "source_url": "https://www.ca4.uscourts.gov/rules/Rule03.html"
        },
        "supporting": []
      },
      "authorized_role_ids": []
    },
    {
      "operation_id": "ca4r54b.operation.advance-docketed",
      "stage_id": "ca4r54b.stage.notice-window",
      "opcode": "advance_stage",
      "authority": {
        "primary": {
          "authority_id": "ca4r54b.authority.frap-12",
          "citation": "Fed. R. App. P. 12(a) (Fourth Circuit rulebook Mar. 23, 2026)",
          "source_version": "2026-03-23",
          "proposition": "After receiving the notice of appeal and district docket entries, the circuit clerk dockets the appeal under the district-court title and identifies the appellant.",
          "source_url": "https://www.ca4.uscourts.gov/rules/Rule12.html"
        },
        "supporting": []
      },
      "next_stage_id": "ca4r54b.stage.docketed",
      "authorized_role_ids": ["ca4r54b.role.court"]
    },
    {
      "operation_id": "ca4r54b.operation.enter-docketing-notice",
      "stage_id": "ca4r54b.stage.docketed",
      "opcode": "enter_order",
      "authority": {
        "primary": {
          "authority_id": "ca4r54b.authority.frap-12",
          "citation": "Fed. R. App. P. 12(a) (Fourth Circuit rulebook Mar. 23, 2026)",
          "source_version": "2026-03-23",
          "proposition": "After receiving the notice of appeal and district docket entries, the circuit clerk dockets the appeal under the district-court title and identifies the appellant.",
          "source_url": "https://www.ca4.uscourts.gov/rules/Rule12.html"
        },
        "supporting": []
      },
      "authorized_role_ids": ["ca4r54b.role.court"]
    },
    {
      "operation_id": "ca4r54b.operation.calculate-initial-deadline",
      "stage_id": "ca4r54b.stage.docketed",
      "opcode": "calculate_deadline",
      "authority": {
        "primary": {
          "authority_id": "ca4r54b.authority.loc-r-3b",
          "citation": "4th Cir. Loc. R. 3(b) (Mar. 23, 2026)",
          "source_version": "2026-03-23",
          "proposition": "Counsel filing a direct or cross-appeal must file the court's docketing statement within 14 days after docketing, serve it, and attach any transcript order.",
          "source_url": "https://www.ca4.uscourts.gov/rules/Rule03.html"
        },
        "supporting": [
          {
            "authority_id": "ca4r54b.authority.initial-documents",
            "citation": "Fourth Circuit, Appearance, Disclosure & Docketing Statements (March 2026 page, checked Aug. 11, 2026)",
            "source_version": "2026-08-11",
            "proposition": "Counsel appearance, applicable corporate disclosure, and the appellant's docketing statement are ordinarily filed within 14 days after appellate docketing; the docketing statement includes the transcript order.",
            "source_url": "https://www.ca4.uscourts.gov/appellateprocedureguide/Initial_Requirements/APG-appearancedisclosuredocketing.html"
          }
        ]
      },
      "deadline_days": 14,
      "deadline_counting": "calendar_days",
      "authorized_role_ids": ["ca4r54b.role.court"]
    },
    {
      "operation_id": "ca4r54b.operation.advance-initial-requirements",
      "stage_id": "ca4r54b.stage.docketed",
      "opcode": "advance_stage",
      "authority": {
        "primary": {
          "authority_id": "ca4r54b.authority.loc-r-3b",
          "citation": "4th Cir. Loc. R. 3(b) (Mar. 23, 2026)",
          "source_version": "2026-03-23",
          "proposition": "Counsel filing a direct or cross-appeal must file the court's docketing statement within 14 days after docketing, serve it, and attach any transcript order.",
          "source_url": "https://www.ca4.uscourts.gov/rules/Rule03.html"
        },
        "supporting": []
      },
      "next_stage_id": "ca4r54b.stage.initial-requirements",
      "authorized_role_ids": ["ca4r54b.role.court"]
    },
    {
      "operation_id": "ca4r54b.operation.accept-initial-documents",
      "stage_id": "ca4r54b.stage.initial-requirements",
      "opcode": "accept_filing",
      "authority": {
        "primary": {
          "authority_id": "ca4r54b.authority.initial-documents",
          "citation": "Fourth Circuit, Appearance, Disclosure & Docketing Statements (March 2026 page, checked Aug. 11, 2026)",
          "source_version": "2026-08-11",
          "proposition": "Counsel appearance, applicable corporate disclosure, and the appellant's docketing statement are ordinarily filed within 14 days after appellate docketing; the docketing statement includes the transcript order.",
          "source_url": "https://www.ca4.uscourts.gov/appellateprocedureguide/Initial_Requirements/APG-appearancedisclosuredocketing.html"
        },
        "supporting": [
          {
            "authority_id": "ca4r54b.authority.frap-10",
            "citation": "Fed. R. App. P. 10(a), (b) and 4th Cir. Loc. R. 10 (Mar. 23, 2026)",
            "source_version": "2026-03-23",
            "proposition": "The appellate record consists of the district papers and exhibits, any transcript, and a certified docket; within 14 days after notice the appellant orders necessary transcript or certifies that none will be ordered.",
            "source_url": "https://www.ca4.uscourts.gov/rules/Rule10.html"
          }
        ]
      },
      "authorized_role_ids": ["ca4r54b.role.appellant"]
    },
    {
      "operation_id": "ca4r54b.operation.reject-initial-documents",
      "stage_id": "ca4r54b.stage.initial-requirements",
      "opcode": "reject_filing",
      "authority": {
        "primary": {
          "authority_id": "ca4r54b.authority.loc-r-3b",
          "citation": "4th Cir. Loc. R. 3(b) (Mar. 23, 2026)",
          "source_version": "2026-03-23",
          "proposition": "Counsel filing a direct or cross-appeal must file the court's docketing statement within 14 days after docketing, serve it, and attach any transcript order.",
          "source_url": "https://www.ca4.uscourts.gov/rules/Rule03.html"
        },
        "supporting": []
      },
      "authorized_role_ids": []
    },
    {
      "operation_id": "ca4r54b.operation.deficiency-initial-documents",
      "stage_id": "ca4r54b.stage.initial-requirements",
      "opcode": "issue_deficiency",